<?xml version="1.0" encoding="gbk" ?>
<config xmlns:xsi="http://www.w3.org/2001/XMLSchema-instance"
xsi:noNamespaceSchemaLocation="codegen.xsd">
	<charset>UTF-8</charset>
	<!--
	<database dbHelperClass="com.codash.cgm.db.impl.MySqlHelper" url="jdbc:mysql://localhost:3306/bgb?useUnicode=true&amp;characterEncoding=utf-8" username="root" password="root"/>
	<database dbHelperClass="com.codash.cgm.db.impl.MySqlHelper" url="jdbc:mysql://localhost:3306/bpm?useUnicode=true&amp;characterEncoding=utf-8" username="root" password="000"/>
	-->
	<database dbHelperClass="com.codash.cgm.db.impl.Sql2005Helper" url="jdbc:sqlserver://192.168.1.33;databaseName=DBIS" username="sa" password="bgb"/>

	<variables>
		<variable name="developer" value="codash" />
		<variable name="email" value="240018840@qq.com" />
		<variable name="company" value="gbg" />
	</variables>
	
	<templates basepath="D:\DBIS\DBIS\metadata\codegen\templateext">
		<template id="javaMapper" path="javaMapper.ftl" />
		<template id="javaModel" path="javaModel.ftl" />
		<template id="javaDao" path="javaDao.ftl" />
		<template id="javaController" path="javaController.ftl" />
		<template id="javaFormcontroller" path="javaFormcontroller.ftl"/>
		<template id="javaService" path="javaService.ftl" />
		<template id="javaFormValid" path="javaFormValid.ftl" />
		<template id="javaFormproperties_zh_CN" path="javaFormproperties_zh_CN.ftl" />
		<template id="javaFormproperties_en" path="javaFormproperties_en.ftl" />

		<template id="jsSearchForm" path="jsSearchForm.js"/>
		<template id="jsUpdateWin" path="jsUpdateWin.js"/>
		<template id="jsSearchGrid" path="jsSearchGrid.js"/>
		<template id="jsView" path="jsView.js"/>
		<template id="jsController" path="jsController.js" />
		<template id="jsModel" path="jsModel.js" />
		<template id="jsStore" path="jsStore.js" />
	</templates>
	
	<files baseDir="D:\DBIS\DBIS" >
		<file refTemplate="javaModel" filename="{class}.java" dir="src\main\java\com\codash\platform\model" />
		<file refTemplate="javaDao" filename="{class}Dao.java" dir="src\main\java\com\codash\platform\dao\{package}" />
		<file refTemplate="javaService" filename="{class}Service.java" dir="src\main\java\com\codash\platform\service\{package}" />
		<file refTemplate="javaController" filename="{class}Controller.java" dir="src\main\java\com\codash\platform\controller\{package}" />
		<file refTemplate="javaFormcontroller" filename="{class}FormController.java" dir="src\main\java\com\codash\platform\controller\{package}" />
		<file refTemplate="javaMapper" filename="{class}.map.xml" dir="src\main\resources\com\codash\platform\maper" />
		<file refTemplate="javaFormValid" filename="formValid.xml" dir="src\main\resources\conf\valid" append="true" insertTag="&lt;/formset&gt;" startTag="&lt;!--start_{tabname}--&gt;" endTag="&lt;!--end_{tabname}--&gt;"/>
		<file refTemplate="javaFormproperties_zh_CN" filename="form_zh_CN.properties" dir="src\main\resources\resource" append="true" insertTag="#insertbefore" startTag="#start_{tabname}" endTag="#end_{tabname}" />
		<file refTemplate="javaFormproperties_en" filename="form_en.properties" dir="src\main\resources\resource" append="true" insertTag="#insertbefore" startTag="#start_{tabname}" endTag="#end_{tabname}" />

		<file refTemplate="jsSearchForm" filename="SearchForm.js" dir="src\main\webapp\app\view\{jsPackage}" />
		<file refTemplate="jsUpdateWin" filename="UpdateWin.js" dir="src\main\webapp\app\view\{jsPackage}" />	
		<file refTemplate="jsSearchGrid" filename="SearchGrid.js" dir="src\main\webapp\app\view\{jsPackage}" />	
		<file refTemplate="jsView" filename="{class}.js" dir="src\main\webapp\app\view\{jsPackage}" />	
		<file refTemplate="jsController" filename="{class}.js" dir="src\main\webapp\app\controller" />	
		<file refTemplate="jsModel" filename="{class}Model.js" dir="src\main\webapp\app\model" />	
		<file refTemplate="jsStore" filename="{class}Store.js" dir="src\main\webapp\app\store" />	
	</files>
	
	<table tableName="Company" >
		<variable name="class"      value="Company" />
		<variable name="classVar"   value="company" />
		<variable name="package"    value="exchange" /><!--java package-->
		<variable name="path"       value="exchange" /> <!--path must as the same package-->
		<variable name="jsPackage"  value="company" />
	</table>
	
	
	
	<!-- 
	<genAll tableNames="CMS_COLUMN,CMS_LINK,TB_CMS_CREATE_TABLE">
		<file refTemplate="allTable" dir="E:\temp\cms\all" filename="alltable.html"  genMode="SingleFile"></file>
		<file refTemplate="tbdoc" dir="E:\temp\cms\all" extName="html"  genMode="MultiFile"></file>
	</genAll>
	 -->
</config>